{"action":[{"action":[1],"action_id":"m0-controller-hold","expected_direction":"hold","natural_date":"2000-01-01","reference_tick":0,"task_id":"fiscal_stabilization_v1"},{"action":[2],"action_id":"m0-controller-expand","expected_direction":"up","natural_date":"2000-01-08","reference_tick":7,"task_id":"fiscal_stabilization_v1"}],"calendar_start":"2000-01-01","policy":[{"actions":[{"lever":"monetary_regime","value":"manual"},{"lever":"manual_policy_rate","value":0.0001}],"decision_date":"2000-01-31","declared_lag_ticks":0,"economy_id":0,"emergency":true,"expected_effective_date":"2000-01-31","expected_event_ids":["event.controller.policy_transaction_effective"],"group":"monetary_stance","reference_tick":30,"seat":"central_bank","transaction_id":"tape-policy-central-bank-001"},{"actions":[{"lever":"spr_target_units","value":10000.0}],"decision_date":"2000-02-10","declared_lag_ticks":7,"economy_id":0,"emergency":false,"expected_effective_date":"2000-02-17","expected_event_ids":["event.controller.policy_transaction_effective"],"group":"energy_operations","reference_tick":40,"seat":"energy","transaction_id":"tape-policy-energy-001"},{"actions":[{"lever":"tariff","value":0.05}],"counterparty_economy_id":1,"decision_date":"2000-02-20","declared_lag_ticks":14,"economy_id":0,"emergency":false,"expected_effective_date":"2000-03-05","expected_event_ids":["event.controller.policy_transaction_effective"],"group":"trade_and_migration","reference_tick":50,"seat":"external_affairs","transaction_id":"tape-policy-external-001"},{"actions":[{"lever":"mortgage_dsti_cap","value":0.425}],"decision_date":"2000-03-01","declared_lag_ticks":7,"economy_id":0,"emergency":false,"expected_effective_date":"2000-03-08","expected_event_ids":["event.controller.policy_transaction_effective"],"group":"macroprudential","reference_tick":60,"seat":"regulator","transaction_id":"tape-policy-regulator-001"},{"actions":[{"lever":"gov_deficit_target","value":0.005}],"decision_date":"2000-03-11","declared_lag_ticks":7,"economy_id":0,"emergency":false,"expected_effective_date":"2000-03-18","expected_event_ids":["event.controller.policy_transaction_effective"],"group":"fiscal_stance","reference_tick":70,"seat":"treasury","transaction_id":"tape-policy-treasury-001"}],"realization":[{"distribution":"uniform","natural_date":"2000-01-01","parameters":[0.0,1.0],"realization_id":"m0-economy-main-uniform-001","reference_tick":0,"stream_id":"rng.stream.case-macro_sim-economy-economy-init.self-rng","value":0.5811521325045647}],"schema_version":"m0-tape-source-v1","shock":{"name":"m0-all-default-kinds","schema_version":1,"specs":[{"announcement_tick":8,"calibration_note":"","correlation_group":"real-side","duration_ticks":8,"kind":"productivity","magnitude":0.1,"ramp_in_ticks":2,"ramp_out_ticks":2,"roles":[],"schema_version":1,"shock_id":"m0-productivity","source":"m0_fixture","start_tick":10,"tags":["m0"],"target":{"economy_ids":[0],"sectors":["consumption"]},"visibility":"public"},{"announcement_tick":19,"calibration_note":"","correlation_group":"real-side","duration_ticks":6,"kind":"labor_availability","magnitude":0.08,"ramp_in_ticks":0,"ramp_out_ticks":2,"roles":[],"schema_version":1,"shock_id":"m0-labor","source":"m0_fixture","start_tick":20,"tags":["m0"],"target":{"economy_ids":[0],"sectors":[]},"visibility":"public"},{"announcement_tick":27,"calibration_note":"","correlation_group":"supply","duration_ticks":10,"kind":"energy_capacity","magnitude":0.15,"ramp_in_ticks":2,"ramp_out_ticks":3,"roles":[],"schema_version":1,"shock_id":"m0-energy","source":"m0_fixture","start_tick":30,"tags":["m0"],"target":{"economy_ids":[0],"sectors":["energy"]},"visibility":"public"},{"announcement_tick":40,"calibration_note":"","correlation_group":"demand","duration_ticks":9,"kind":"household_demand","magnitude":0.12,"ramp_in_ticks":0,"ramp_out_ticks":3,"roles":[],"schema_version":1,"shock_id":"m0-demand","source":"m0_fixture","start_tick":40,"tags":["m0"],"target":{"economy_ids":[0],"sectors":[]},"visibility":"public"},{"announcement_tick":48,"calibration_note":"","correlation_group":"external","duration_ticks":7,"kind":"import_capacity","magnitude":0.2,"ramp_in_ticks":0,"ramp_out_ticks":2,"roles":[],"schema_version":1,"shock_id":"m0-import","source":"m0_fixture","start_tick":50,"tags":["m0"],"target":{"economy_ids":[0],"sectors":[]},"visibility":"public"},{"announcement_tick":48,"calibration_note":"","correlation_group":"external","duration_ticks":7,"kind":"export_capacity","magnitude":0.18,"ramp_in_ticks":0,"ramp_out_ticks":2,"roles":[],"schema_version":1,"shock_id":"m0-export","source":"m0_fixture","start_tick":50,"tags":["m0"],"target":{"economy_ids":[1],"sectors":[]},"visibility":"public"},{"announcement_tick":55,"calibration_note":"","correlation_group":"finance","duration_ticks":12,"kind":"credit_supply","magnitude":0.25,"ramp_in_ticks":2,"ramp_out_ticks":4,"roles":[],"schema_version":1,"shock_id":"m0-credit","source":"m0_fixture","start_tick":60,"tags":["m0"],"target":{"economy_ids":[0],"sectors":[]},"visibility":"public"},{"announcement_tick":65,"calibration_note":"","correlation_group":"disaster","duration_ticks":1,"kind":"capital_destruction","magnitude":0.1,"ramp_in_ticks":0,"ramp_out_ticks":0,"roles":[],"schema_version":1,"shock_id":"m0-destruction","source":"m0_fixture","start_tick":70,"tags":["m0"],"target":{"economy_ids":[0],"sectors":["capital"]},"visibility":"public"}]}}
